long,lat,objectID,siteName,siteStatus,siteAddress,siteAddress2,siteCity,siteState,siteZip,sitePhone,ext,contactFirstName,contactLastName,contactPhone,sponsoringOrganization,startDate,endDate,daysofOperation,comments,breakfastTime,lunchTime,snackTimeAM,snackTimePM,dinnerSupperTime,mealTypesServed,cycleNumber,recordStatus,country,fnsid,created,season,county
-90.0513546,30.01433246,86980,NORDC Outdoors Teen Career Camp,Open,"5420 Franklin Avenue New Orleans, LA 70122",,New Orleans,LA,70122,5042024042,,PAMALA,THOMAS,5043158859,The Healthy School Food Collaborative,2019-05-01T04:00:00.000Z,2019-08-31T04:00:00.000Z,"M,T,W,TH,F",8:00AM-12:30PM,8:00AM-8:30AM,12:00PM-12:30PM,,,,,7,N,US,108188,,2019,Orleans
-90.07683276,29.97744203,86995,Camp Oya!,Open,"1474 North Broad Street New Orleans, LA 70119",,New Orleans,LA,70119,5044007224,,Journey,Allen,5044007224,The Healthy School Food Collaborative,2019-05-01T04:00:00.000Z,2019-08-31T04:00:00.000Z,"M,T,W,TH,F",8:00AM-1:00PM,8:00AM-9:00AM,12:00PM-1:00PM,,,,,7,N,US,142380,,2019,Orleans
-89.98926419,30.02786734,86996,Excite All Stars,Open,"8600 Lake Forest New Orleans, LA 70126",,New Orleans,LA,70126,5047170085,,Penny,Williams,5047170085,The Healthy School Food Collaborative,2019-05-01T04:00:00.000Z,2019-08-31T04:00:00.000Z,"M,T,W,TH,F",7:45AM-11:30AM,7:45AM-8:30AM,11:00AM-11:30AM,,,,,7,N,US,142933,,2019,Orleans
-90.08752958,29.96712226,86997,Hope Community Resource Center,Open,"2740 Iberville Street New Orleans, LA 70122",,New Orleans,LA,70122,5044181256,,Noreen,Jacobs,5043121333,The Healthy School Food Collaborative,2019-05-01T04:00:00.000Z,2019-08-31T04:00:00.000Z,"M,T,W,TH,F",12:30PM-1:00PM,,,,12:30PM-1:00PM,,,7,N,US,95944,,2019,Orleans
-90.08332393,29.93679428,86999,1881 Stem//Cultural Arts Summer Camp,Open,"2220 Oretha Castle Haley Blvd New Orleans, LA 70126",,New Orleans,LA,70126,5042281461,,Debra,Robertson,5049752645,The Healthy School Food Collaborative,2019-05-01T04:00:00.000Z,2019-08-31T04:00:00.000Z,,9:00AM-1:00PM,9:00AM-10:00AM,12:00PM-1:00PM,,,,,7,N,US,102667,,2019,Orleans
-90.06996571,29.94953301,87002,Pan American Life Conference Center & Cafe 601,Open,"601 Poydras Street 11th floor New Orleans, LA 70130",,New Orleans,LA,70130,5045611245,,David,Moffett,5045611244,The Healthy School Food Collaborative,2019-05-01T04:00:00.000Z,2019-08-31T04:00:00.000Z,"M,T,W,TH,F",1:00PM-1:30PM,,1:00PM-1:30PM,10:00AM-11:00AM,,,,7,N,US,108307,,2019,Orleans
-90.07502902,29.99285851,87004,TCA Camp @ NORDC Saint Bernard,Open,"1500 Lafreniere Street New Orleans, LA 70122",,New Orleans,LA,70122,5042899925,,Shanita,Keelen,9014280675,The Healthy School Food Collaborative,2019-05-01T04:00:00.000Z,2019-08-31T04:00:00.000Z,"M,T,W,TH,F",8:00AM-1:00PM,8:00AM-9:00AM,12:00PM-1:00PM,,,,,7,N,US,144980,,2019,Orleans
-90.68697601,29.59158482,87005,LeCirque @ Mechanicville Recreation-Summer Feeding,Open,"2814 Senator Street Houma, LA 70363",,Houma,LA,70363,9853036108,,Nichelle,Frye,9853036108,The Healthy School Food Collaborative,2019-05-01T04:00:00.000Z,2019-08-31T04:00:00.000Z,"T,W,TH",12:00PM-12:30PM,,12:00PM-12:30PM,9:00AM-9:30AM,,,,7,N,US,143674,,2019,Terrebonne
-90.03538323,29.94482551,87009,Golden Feather,Open,"2101 General Meyer New Orleans, LA 70113",,New Orleans,LA,70113,,,Walter,Barnes,5045959491,The Healthy School Food Collaborative,2019-05-01T04:00:00.000Z,2019-08-31T04:00:00.000Z,,9:00AM-10:00AM,9:00AM-10:00AM,,,,,,7,N,US,103751,,2019,Orleans
-91.03657436,30.4233815,87010,Kids Orchestra Summer Day Camp,Open,"3200 Woodland Ridge Baton Rouge, LA 70816",,Baton Rouge,LA,70816,2259224656,,Puja,Thapa,2259224656,The Healthy School Food Collaborative,2019-05-01T04:00:00.000Z,2019-08-31T04:00:00.000Z,,9:00AM-10:00AM,9:00AM-10:00AM,,,,,,7,N,US,99643,,2019,East Baton Rouge
-90.06522139,29.96393174,87011,Knowing Your Destiny @ Willow Apts,Open,"1130 North Rampart Street New Orleans, LA 70126",,New Orleans,LA,70126,5047175522,,Niesha,Freeman,5047175522,The Healthy School Food Collaborative,2019-05-01T04:00:00.000Z,2019-08-31T04:00:00.000Z,,9:00AM-10:00AM,9:00AM-10:00AM,,,,,,7,N,US,115338,,2019,Orleans
-90.05288555,29.97580313,87013,St. Roch Community Church,Open,"1738 St. Roch Ave New Orleans, LA 70117",,New Orleans,LA,70117,5049405771,,Nika,Carter,5042216572,The Healthy School Food Collaborative,2019-05-01T04:00:00.000Z,2019-08-31T04:00:00.000Z,,9:00AM-10:00AM,9:00AM-10:00AM,,,,,,7,N,US,39067,,2019,Orleans
-90.4734483,30.49380204,87014,Tangipahoa Black Heritage Center - Youth Program,Open,"1600 Phoenix Square Hammond, LA 70403",,Hammond,LA,70403,,,Sylvia,Hurst,9859819026,The Healthy School Food Collaborative,2019-05-01T04:00:00.000Z,2019-08-31T04:00:00.000Z,,9:00AM-10:00AM,9:00AM-10:00AM,,,,,,7,N,US,69763,,2019,Tangipahoa
-91.56238689,31.63522721,87015,United Hands Youth Center,Open,"109 Doty Road Ferriday, LA 71334",,Ferriday,LA,71334,3187580857,,Janica,Green,3187580857,The United Hands Youth Center,2019-05-01T04:00:00.000Z,2019-08-31T04:00:00.000Z,"M,T,W,TH,F",8:00AM-1:30PM,8:00AM-9:00AM,12:00PM-1:30PM,,,,,7,N,US,39505,,2019,Concordia
-91.22236141,30.41506329,87017,Adventureland,Open,"1953 West Shore Avenue Port Allen, LA 70767",,Port Allen,LA,70767,2257696177,,Troy,Smart,2257496177,Three OClock Project,2019-05-01T04:00:00.000Z,2019-08-31T04:00:00.000Z,"M,T,W,TH,F",8:00AM-12:00PM,8:00AM-8:30AM,11:00AM-12:00PM,,,,,7,N,US,17297,,2019,West Baton Rouge
-92.07509396,30.5282917,87018,Boys & Girls Club,Open,"814 E Laurent Street Opelousas, LA 70570",,Opelousas,LA,70570,3379483657,,Adrian,Giron,3373224076,Three OClock Project,2019-05-01T04:00:00.000Z,2019-08-31T04:00:00.000Z,"M,T,W,TH,F",8:00AM-1:30PM,8:00AM-9:00AM,12:00PM-1:30PM,,,,,7,N,US,34259,,2019,St. Landry
-93.86553891,32.46664322,87019,Bill Cockrell Recreation Center,Open,"4109 Pines Road Shreveport, LA 71119",,Shreveport,LA,71119,3186294185,,Eric,Anderson,3186294185,Three OClock Project,2019-05-01T04:00:00.000Z,2019-08-31T04:00:00.000Z,"M,T,W,TH,F",12:00PM-4:30PM,,12:00PM-1:30PM,,3:30PM-4:30PM,,,7,N,US,57458,,2019,Caddo
-92.06424845,30.21354667,87020,Boys & Girls Club - Jackie Unit,Open,"1000 Marie Antionette Lafayette, LA 70506",,Lafayette,LA,70506,3379882582,,Joseph,Long,3372802398,Three OClock Project,2019-05-01T04:00:00.000Z,2019-08-31T04:00:00.000Z,"M,T,W,TH,F",8:30AM-1:30PM,8:30AM-9:30AM,12:00PM-1:30PM,,,,,7,N,US,34261,,2019,Lafayette
-93.76935895,32.461056,87023,Hattie Perry Community Center,Open,"4300 Ledbetter Street Shreveport, LA 71108",,Shreveport,LA,71108,3182273350,,S'Nerica,Braden,3186737810,Three OClock Project,2019-05-01T04:00:00.000Z,2019-08-31T04:00:00.000Z,"M,T,W,TH,F",12:00PM-4:30PM,,12:00PM-1:30PM,,3:30PM-4:30PM,,,7,N,US,143302,,2019,Caddo
-92.02179165,30.23388,87024,Boys & Girls Clubs - Granberry Unit,Open,"121 South Washington Street Lafayette, LA 70501",,Lafayette,LA,70501,3372326401,,Harold,Alexander,3372326401,Three OClock Project,2019-05-01T04:00:00.000Z,2019-08-31T04:00:00.000Z,"M,T,W,TH,F",8:30AM-1:30PM,8:30AM-9:30AM,12:00PM-1:30PM,,,,,7,N,US,34288,,2019,Lafayette
-93.77531306,32.50356947,87025,Lakeside Community Center,Open,"2200 Milam Street Shreveport, LA 71103",,Shreveport,LA,71103,3186737812,,Quiana,Hubbard,3186737812,Three OClock Project,2019-05-01T04:00:00.000Z,2019-08-31T04:00:00.000Z,"M,T,W,TH,F",12:00PM-4:30PM,,12:00PM-1:30PM,,3:30PM-4:30PM,,,7,N,US,53007,,2019,Caddo
-93.75539273,32.54300136,87026,Mamie Hicks Park and Community Center,Open,"200 Mayfair Drive Shreveport, LA 71107",,Shreveport,LA,71107,3186736416,,Christopher,Bush,3186736416,Three OClock Project,2019-05-01T04:00:00.000Z,2019-08-31T04:00:00.000Z,"M,T,W,TH,F",12:00PM-4:30PM,,12:00PM-1:30PM,,3:30PM-4:30PM,,,7,N,US,53337,,2019,Caddo
-91.81829392,29.9999645,87027,Boys and Girls Club of Acadiana Iberia Unit,Open,"430 E. Pershing Avenue New Iberia, LA 70560",,New Iberia,LA,70560,3373156125,,Micah,Nicholas,3373647040,Three OClock Project,2019-05-01T04:00:00.000Z,2019-08-31T04:00:00.000Z,"M,T,W,TH,F",8:00AM-2:00PM,8:00AM-9:00AM,12:00PM-2:00PM,,,,,7,N,US,34308,,2019,Iberia
-93.78383601,32.40172597,87028,Southern Hills Recreation,Open,"1002 Bert Kouns Shreveport, LA 71108",,Shreveport,LA,71108,3186737818,,Lois,Reynolds,3186737818,Three OClock Project,2019-05-01T04:00:00.000Z,2019-08-31T04:00:00.000Z,"M,T,W,TH,F",12:00PM-4:30PM,,12:00PM-1:30PM,,3:30PM-4:30PM,,,7,N,US,60187,,2019,Caddo
-93.72039614,32.49428924,87030,Valencia Recreation,Open,"1800 Viking Drive Shreveport, LA 71107",,Shreveport,LA,71107,3186736433,,Johnny,Edwards,3186736433,Three OClock Project,2019-05-01T04:00:00.000Z,2019-08-31T04:00:00.000Z,"M,T,W,TH,F",12:00PM-4:30PM,,12:00PM-1:30PM,,3:30PM-4:30PM,,,7,N,US,145193,,2019,Caddo
-93.76123444,32.46604349,87031,Greater Pleasant Grove,Open,"1500 Grigsby Street Shreveport, LA 71108",,Shreveport,LA,71108,3184260726,,Arlisha,Brooks,3185173850,Three OClock Project,2019-05-01T04:00:00.000Z,2019-08-31T04:00:00.000Z,"M,T,W,TH,F",12:00PM-1:30PM,,12:00PM-1:30PM,,,,,7,N,US,19149,,2019,Caddo
-93.74751403,32.43281053,87032,A.B. Palmer Recreation Center,Open,"547 East 79th Street Shreveport, LA 71106",,Shreveport,LA,71106,3186735336,,Baronette,Robinson,3186735336,Three OClock Project,2019-05-01T04:00:00.000Z,2019-08-31T04:00:00.000Z,"M,T,W,TH,F",12:00PM-4:30PM,,12:00PM-1:30PM,,3:30PM-4:30PM,,,7,N,US,57219,,2019,Caddo
-93.8101626,32.44929665,87033,Airport Park and Community Center,Open,"6500 Kennedy Drive Shreveport, LA 71109",,Shreveport,LA,71109,3182273350,,Gerald,Brown,3186737803,Three OClock Project,2019-05-01T04:00:00.000Z,2019-08-31T04:00:00.000Z,"M,T,W,TH,F",12:00PM-5:00PM,,12:00PM-1:30PM,,4:00PM-5:00PM,,,7,N,US,49659,,2019,Caddo
-92.50208817,30.02478722,87037,St. Matthews Baptist Church,Open,"1109 McMurty Street Gueydan, LA 70542",,Gueydan,LA,70542,9104941784,,Casey,Judge,3375369890,Vermilion Parish School Board,2019-05-01T04:00:00.000Z,2019-08-31T04:00:00.000Z,"M,T,W,TH,F",7:30AM-11:45AM,7:30AM-8:30AM,11:15AM-11:45AM,,,,,7,N,US,96523,,2019,Vermilion
-92.37783202,30.00583592,87038,New Beginnings Primative Baptist Church,Open,"622 East Veteran Memorial Blvd Kaplan, LA 70548",,Kaplan,LA,70548,3376431850,,Shawn,LeBlanc,3376431850,Vermilion Parish School Board,2019-05-01T04:00:00.000Z,2019-08-31T04:00:00.000Z,"M,T,W,TH,F",7:30AM-11:45AM,7:30AM-8:30AM,11:15AM-11:45AM,,,,,7,N,US,144129,,2019,Vermilion
-89.98353827,29.92341433,87039,Cut-off Recreation Center (Covered Kids),Open,"6600 Belgrade Street New Orleans, LA 70131",,New Orleans,LA,70131,5044948776,,Angelique,Francois,5044948776,Volunteers of America Southeast Louisiana Inc,2019-05-01T04:00:00.000Z,2019-08-31T04:00:00.000Z,"M,T,W,TH,F",8:00AM-1:30PM,8:00AM-9:00AM,11:30AM-1:30PM,,,,,7,N,US,124251,,2019,Orleans
-90.02346269,29.96488454,87040,Leona Tate Foundation/Lower Nineth Ward Living Museum,Open,"1235 Deslonde Street New Orleans, LA 70117",,New Orleans,LA,70117,,,Leona,Tate,5042739709,Volunteers of America Southeast Louisiana Inc,2019-05-01T04:00:00.000Z,2019-08-31T04:00:00.000Z,"M,T,W,TH,F",9:00AM-2:00PM,9:00AM-10:00AM,12:00PM-2:00PM,,,,,7,N,US,124458,,2019,Orleans
-90.08697967,29.91881434,87045,New Orleans Ballet Assocation/Noba,Open,"Nordc at the Lyons Center/624 Louisiana Avenue New Orleans, LA 70115",,New Orleans,LA,70115,5045220996,,Susan,Bensinger,5045220996,Volunteers of America Southeast Louisiana Inc,2019-05-01T04:00:00.000Z,2019-08-31T04:00:00.000Z,"M,T,W,TH,F",8:30AM-2:30PM,8:30AM-9:30AM,12:30PM-2:30PM,,,,,7,N,US,37684,,2019,Orleans
-90.09085297,29.93021662,87052,Upturn Arts,Open,"1719 Toledano Street New Orleans, LA 70115",,New Orleans,LA,70115,5043908399,,Cole,Williams,5043908399,Volunteers of America Southeast Louisiana Inc,2019-05-01T04:00:00.000Z,2019-08-31T04:00:00.000Z,"M,T,W,TH,F",9:00AM-2:00PM,9:00AM-10:00AM,12:00PM-2:00PM,,,,,7,N,US,60548,,2019,Orleans
-90.09440356,29.94920903,87053,Urban Impact Ministries,Open,"2344 S. Miro Street New Orleans, LA 70125",,New Orleans,LA,70125,5045235556,,Helen,Harris,5045235566,Volunteers of America Southeast Louisiana Inc,2019-05-01T04:00:00.000Z,2019-08-31T04:00:00.000Z,"M,T,W,TH,F",12:30PM-4:00PM,,12:30PM-2:00PM,,3:30PM-4:00PM,,,7,N,US,88865,,2019,Orleans
-90.22133232,29.97783361,87056,Williams Park,Open,"7744 Mistletoe St. Metairie, LA 70003",,Metairie,LA,70003,5047366992,,Bobbie,Lewis,5047368470,Volunteers of America Southeast Louisiana Inc,2019-05-01T04:00:00.000Z,2019-08-31T04:00:00.000Z,"M,T,W,TH,F",9:00AM-2:00PM,9:00AM-10:00AM,12:00PM-2:00PM,,,,,7,N,US,56718,,2019,Jefferson
-90.02733693,29.94697348,87057,Aligers Auditorium,Open,"2485 Guadualcanal Street New Orleans, LA 70114",,New Orleans,LA,70114,4075837898,,Jerel,Butler,5046698131,Volunteers of America Southeast Louisiana Inc,2019-05-01T04:00:00.000Z,2019-08-31T04:00:00.000Z,"M,T,W,TH,F",8:00AM-2:00PM,8:00AM-9:00AM,12:00PM-2:00PM,,,,,7,N,US,141970,,2019,Orleans
-90.04988825,29.95049775,87058,International School of LA - Westbank Orleans,Open,"502 Oliver St. New Orleans, LA 70114",,New Orleans,LA,70114,5045222667,,Arden,Guieiredo,5045222667,Volunteers of America Southeast Louisiana Inc,2019-05-01T04:00:00.000Z,2019-08-31T04:00:00.000Z,"M,T,W,TH,F",9:00AM-1:45PM,9:00AM-10:00AM,12:00PM-1:45PM,,,,,7,N,US,143452,,2019,Orleans
-90.12167337,29.93374619,87059,Loyola University (Electric Girls Summer Camp),Open,"6363 St Charles Ave New Orleans, LA 70118",,New Orleans,LA,70118,6155851434,,Flor,Serna,5058507578,Volunteers of America Southeast Louisiana Inc,2019-05-01T04:00:00.000Z,2019-08-31T04:00:00.000Z,"M,T,W,TH,F",11:30AM-1:30PM,,11:30AM-1:30PM,,,,,7,N,US,115482,,2019,Orleans
-90.01943182,29.88868923,87060,Athlos Academy of Jefferson,Open,"979 Behrman Hwy Terrytown, LA 70056",,Terrytown,LA,70056,2254089892,,Erin,LaBostrie,5042902510,Volunteers of America Southeast Louisiana Inc,2019-05-01T04:00:00.000Z,2019-08-31T04:00:00.000Z,"M,T,W,TH,F",7:15AM-1:15PM,7:15AM-8:15AM,11:15AM-1:15PM,,,,,7,N,US,142052,,2019,Jefferson
-90.10168797,29.97511228,87063,Mid City Library,Open,"4140 Canal Library New Orleans, LA 70119",,New Orleans,LA,70119,5045962658,,Robin,Goldblum,5045962656,Volunteers of America Southeast Louisiana Inc,2019-05-01T04:00:00.000Z,2019-08-31T04:00:00.000Z,"M,T,W,TH,F",3:30PM-4:30PM,,,11:30AM-12:30PM,3:30PM-4:30PM,,,7,N,US,124512,,2019,Orleans
-90.11214064,29.97169508,87065,Life Transformation Center Celebration Church,Open,"8606 Marks Street New Orleans, LA 70118",,New Orleans,LA,70118,5042962934,,Carolyn,Tilton,5042962934,Volunteers of America Southeast Louisiana Inc,2019-05-01T04:00:00.000Z,2019-08-31T04:00:00.000Z,"M,T,W,TH,F",8:00AM-1:00PM,8:00AM-9:00AM,11:00AM-1:00PM,,,,,7,N,US,143708,,2019,Orleans
-90.09639597,29.95443267,87066,Boys & Girls Club NFL-YET,Open,"1140 S Broad St New Orleans, LA 70125",,New Orleans,LA,70125,5042620626,,Connie,Smith,5043097952,Volunteers of America Southeast Louisiana Inc,2019-05-01T04:00:00.000Z,2019-08-31T04:00:00.000Z,"M,T,W,TH,F",12:00PM-4:00PM,,12:00PM-2:00PM,,3:00PM-4:00PM,,,7,N,US,142266,,2019,Orleans
-90.08779686,29.96985219,87067,House of Healing Outreach Church,Open,"2912 Conti Street New Orleans, LA 70119",,New Orleans,LA,70119,5042378361,,Valery,Green,5042378361,Volunteers of America Southeast Louisiana Inc,2019-05-01T04:00:00.000Z,2019-08-31T04:00:00.000Z,"M,T,W,TH,F",8:00AM-2:00PM,8:00AM-9:00AM,12:00PM-2:00PM,,,,,7,N,US,143396,,2019,Orleans
-90.06750031,29.97571963,87068,Nora Navra Library - Summer Feeding,Open,"1902 St. Bernard Avenue New Orleans, LA 70116",,New Orleans,LA,70116,5045963118,,Adam,Beebe,5045963118,Volunteers of America Southeast Louisiana Inc,2019-05-01T04:00:00.000Z,2019-08-31T04:00:00.000Z,"M,T,W,TH,F",3:00PM-4:00PM,,,,3:00PM-4:00PM,,,7,N,US,144179,,2019,Orleans
-90.08542224,30.72741571,87070,Enon Baptist Church,Open,"14049 Highway 16 Franklinton, LA 70438",,Franklinton,LA,70438,9857952517,,Cindy,Pace,9855157615,Washington Parish School Board,2019-05-01T04:00:00.000Z,2019-08-31T04:00:00.000Z,"M,T,W,TH,F",10:45AM-11:45AM,,10:45AM-11:45AM,,,,,7,N,US,35539,,2019,Washington
-90.15422599,30.88390225,87071,Faith in the Word,Open,"44238 Vessier Road Franklinton, LA 70438",,Franklinton,LA,70438,9858393436,,Anita,Warren,9855157341,Washington Parish School Board,2019-05-01T04:00:00.000Z,2019-08-31T04:00:00.000Z,"M,T,W,TH",6:15PM-7:00PM,,,,,6:15PM-7:00PM,,7,N,US,106967,,2019,Washington
-90.15628491,30.84579116,87072,First Baptist Church,Open,"903 Cleveland Street Franklinton, LA 70438",,Franklinton,LA,70438,9858393427,,Kellie,McElveen,9858393427,Washington Parish School Board,2019-05-01T04:00:00.000Z,2019-08-31T04:00:00.000Z,"M,T,W,TH",11:15AM-12:00PM,,11:15AM-12:00PM,,,,,7,N,US,35687,,2019,Washington
-89.80231258,30.90725721,87073,First Missionary Baptist Church,Open,"26052 Pearson Street Angie, LA 70426",,Angie,LA,70426,9855159145,,Debbie,Magee,9855159145,Washington Parish School Board,2019-05-01T04:00:00.000Z,2019-08-31T04:00:00.000Z,"M,T,W,TH,F",5:30PM-6:30PM,,,,,5:30PM-6:30PM,,7,N,US,35714,,2019,Washington
-89.8251619,30.898247,87074,Mary's Chapel United Methodist,Open,"63343 Jones Creek Road Varnado, LA 70428",,Varnado,LA,70428,9858393436,,Gloria,Davis,9855153085,Washington Parish School Board,2019-05-01T04:00:00.000Z,2019-08-31T04:00:00.000Z,"M,T,W,TH,F",6:15PM-7:00PM,,,,,6:15PM-7:00PM,,7,N,US,107894,,2019,Washington
-90.29604046,30.95707154,87075,Mt. Hermon Baptist Church,Open,"36126 Hwy 38 Mt. Hermon, LA 70450",,Mt. Hermon,LA,70450,9858774751,,Stacey,Breaud,9853354256,Washington Parish School Board,2019-05-01T04:00:00.000Z,2019-08-31T04:00:00.000Z,"M,T,W,TH",5:00PM-6:00PM,,,,,5:00PM-6:00PM,,7,N,US,87420,,2019,Washington
-90.31287407,30.92932739,87076,Mt. Olive Baptist Church,Open,"28040 Mt. Olive Baptist Church Mt. Hermon, LA 70450",,Mt. Hermon,LA,70450,9855159530,,Anna,Dillon,9855159530,Washington Parish School Board,2019-05-01T04:00:00.000Z,2019-08-31T04:00:00.000Z,"M,T,W,TH",6:00PM-7:00PM,,,,,6:00PM-7:00PM,,7,N,US,115699,,2019,Washington
-89.81628905,30.89913274,87077,Mt. Zion Baptist Church,Open,"64115 Jones Creek Road Varnado, LA 70426",,Varnado,LA,70426,9855165994,,Annie,Moses,9855165994,Washington Parish School Board,2019-05-01T04:00:00.000Z,2019-08-31T04:00:00.000Z,"M,T,W,TH,F",5:45PM-6:45PM,,,,,5:45PM-6:45PM,,7,N,US,37536,,2019,Washington
-89.96895456,30.75148468,87079,Plainview Baptist Church,Open,"55179 Highway 60 Bogalusa, LA 70427",,Bogalusa,LA,70427,9853358528,,Michelle,Breland,9853358528,Washington Parish School Board,2019-05-01T04:00:00.000Z,2019-08-31T04:00:00.000Z,"M,T,W,TH,F",6:00PM-7:00PM,,,,,6:00PM-7:00PM,,7,N,US,38161,,2019,Washington
-90.1413544,30.8525139,87080,Sweet Home Church of Christ Holiness,Open,"2200 Greenlaw Street Franklinton, LA 70438",,Franklinton,LA,70438,9855154519,,Pamela,Magee,9855154519,Washington Parish School Board,2019-05-01T04:00:00.000Z,2019-08-31T04:00:00.000Z,"M,T,W,TH",6:00PM-7:00PM,,,,,6:00PM-7:00PM,,7,N,US,98584,,2019,Washington
-90.15129435,30.85090762,87083,Magee's Temple Church,Open,"703 14th Avenue Franklinton, LA 70438",,Franklinton,LA,70438,9855154327,,Anita,Brumfield,9855150481,Washington Parish School Board,2019-05-01T04:00:00.000Z,2019-08-31T04:00:00.000Z,"M,T,W,TH",6:00PM-6:45PM,,,,,6:00PM-6:45PM,,7,N,US,143801,,2019,Washington
-89.84099103,30.82494595,87084,Highland Baptist Church,Open,"21022 Hwy 21 N Bogalusa, LA 70427",,Bogalusa,LA,70427,9855168866,,Allison,Walters,9855168866,Washington Parish School Board,2019-05-01T04:00:00.000Z,2019-08-31T04:00:00.000Z,"M,T,W,TH,F",5:00PM-5:45PM,,,,,5:00PM-5:45PM,,7,N,US,143349,,2019,Washington
-89.81257107,30.96373867,87085,Angie Baptist Church,Open,"64458 Royal Street Angie, LA 70426",,Angie,LA,70426,9855165353,,Melanie,Kennedy,9855165353,Washington Parish School Board,2019-05-01T04:00:00.000Z,2019-08-31T04:00:00.000Z,"M,T,W,TH,F",11:00AM-11:30AM,,11:00AM-11:30AM,,,,,7,N,US,142008,,2019,Washington
-89.82304197,30.89986289,87087,Mt. Zion Missionary Baptist Church,Open,"63428 Jones Creek Road Angie, LA 70426",,Angie,LA,70426,9857326255,,Clarnetta,Arrington,9857500130,Washington Parish School Board,2019-05-01T04:00:00.000Z,2019-08-31T04:00:00.000Z,"M,T,W,TH,F",6:00PM-6:45PM,,,,,6:00PM-6:45PM,,7,N,US,53814,,2019,Washington
-90.12848296,30.97853177,87088,Greater Hayes Creek Missionary Baptist Church,Open,"31499 Hayes Creek Road Franklinton, LA 70438",,Franklinton,LA,70438,9858399624,,Bobbie,Warren,9858392868,Washington Parish School Board,2019-05-01T04:00:00.000Z,2019-08-31T04:00:00.000Z,"M,T,W,TH",6:15PM-7:00PM,,,,,6:15PM-7:00PM,,7,N,US,115002,,2019,Washington
-90.10963886,30.96614533,87089,Hayes United Methodist Church,Open,"30891 Old Columbia Road Franklinton, LA 70438",,Franklinton,LA,70438,,,Pat,Harvey,9855150481,Washington Parish School Board,2019-05-01T04:00:00.000Z,2019-08-31T04:00:00.000Z,"M,T",5:00PM-5:30PM,,,,,5:00PM-5:30PM,,7,N,US,36223,,2019,Washington
-90.1313041,30.84721251,87091,Hillcrest Baptist Church,Open,"2201 East Washington Street Franklinton, LA 70438",,Franklinton,LA,70438,9858394703,,Rose,Bond,9858394703,Washington Parish School Board,2019-05-01T04:00:00.000Z,2019-08-31T04:00:00.000Z,,11:00AM-12:00PM,,11:00AM-12:00PM,,,,,7,N,US,36305,,2019,Washington
-90.14421401,30.85007066,87092,Sweet Rest Baptist Church,Open,"1811 Desmare Street Franklinton, LA 70438",,Franklinton,LA,70438,9858393238,,Emma,Route,9855159731,Washington Parish School Board,2019-05-01T04:00:00.000Z,2019-08-31T04:00:00.000Z,"M,T,W",5:45PM-6:30PM,,,,,5:45PM-6:30PM,,7,N,US,65167,,2019,Washington
-93.73016758,32.51904341,87094,Bossier High School,Open,"777 Bearkat Dr Bossier City, LA 71111",,Bossier City,LA,71111,3185495047,,Karla,Horton,3185495047,Bossier Parish School Board,2019-05-28T04:00:00.000Z,2019-06-20T04:00:00.000Z,"M,T,W,TH",,7:15AM,10:30AM,,,,,7,N,US,142244,,2019,Bossier
-91.13502635,30.58400894,87095,Baker Middle School,Open,"5903 Groom Rd Baker, LA 70714",,Baker,LA,70714,2257782370,,Henry,Belin,2257782370,City of Baker School District,2019-06-03T04:00:00.000Z,2019-06-27T04:00:00.000Z,"M,T,W,TH",,7:30AM,11:00AM,,,,,7,N,US,34011,,2019,East Baton Rouge
-91.12640007,30.58059801,87096,Advantage Charter Academy,Open,"14740 Plank Road Baker, LA 70714",,Baker,LA,70714,6169543529,,Mike,Vermeer,6169543529,"Inspire Charter Academy, Inc.",2019-05-28T04:00:00.000Z,2019-06-27T04:00:00.000Z,"M,T,W,TH",,7:30AM,11:00AM,,,,,7,N,US,15,,2019,East Baton Rouge
-92.69473792,30.4800938,97781,Keagan Center,Open,"211 Pine Street Elton, LA 70532",,Elton,LA,70532,3376588688,,Kim,Thibodeaux,3375261577,ASSIST Agency Inc,2019-05-01T04:00:00.000Z,2019-08-31T04:00:00.000Z,"M,T,W,TH,F",11:00AM-11:30AM,,11:00AM-11:30AM,,,,,7,U,US,95081,,2019,Jefferson Davis
-92.82171947,30.23898157,97782,Our Lady Of Seven Dolors,Open,"209 North Adams Welsh, LA 70591",,Welsh,LA,70591,3377343848,,Dana,Hall,3373708075,ASSIST Agency Inc,2019-05-01T04:00:00.000Z,2019-08-31T04:00:00.000Z,"M,T,W,TH,F",11:00AM-12:00PM,,11:00AM-12:00PM,,,,,7,U,US,115869,,2019,Jefferson Davis
-89.89733702,29.91053633,97799,Christian Fellowship Full Gospel Baptist Church,Open,"5816 E Judge Perez Dr Violet, LA 70092",,Violet,LA,70092,5046827537,,Dana,Johnson,5043244092,Christian Fellowship Full Gospel Baptist Church Inc,2019-05-01T04:00:00.000Z,2019-08-31T04:00:00.000Z,"M,T,W,TH,F",8:00AM-12:00PM,8:00AM-9:00AM,11:00AM-12:00PM,,,,,7,U,US,540,,2019,St. Bernard
-91.50777915,29.7878676,97800,Broussard-Harris Recreation Center,Open,"508 O'Neil Chube Street Franklin, LA 70538",,Franklin,LA,70538,3378286323,,Jeannie,Benjamin,3378286325,City of Franklin,2019-05-01T04:00:00.000Z,2019-08-31T04:00:00.000Z,"M,T,W,TH,F",8:00AM-1:00PM,8:00AM-9:00AM,12:00PM-1:00PM,,,,,7,U,US,69618,,2019,St. Mary
-91.4978361,29.80367414,97801,City Park Recreation Center,Open,"Gumm St Franklin, LA 70538",,Franklin,LA,70538,3378286384,,Virdia,Gasper,3378286324,City of Franklin,2019-05-01T04:00:00.000Z,2019-08-31T04:00:00.000Z,"M,T,W,TH,F",8:00AM-1:00PM,8:00AM-9:00AM,12:00PM-1:00PM,,,,,7,U,US,545,,2019,St. Mary
-93.19796045,30.25382667,97803,Carver Court,Open,"1409 St Mary Dr Lake Charles, LA 70601",,Lake Charles,LA,70601,3374911440,,Tonja,Johnson,3374911270,City of Lake Charles,2019-05-01T04:00:00.000Z,2019-08-31T04:00:00.000Z,"M,T,W,TH,F",8:00AM-12:00PM,8:00AM-9:00AM,11:00AM-12:00PM,,,,,7,U,US,34637,,2019,Calcasieu
-93.18852797,30.17959753,97804,Christian Baptist Church,Open,"4460 5th Avenue Lake Charles, LA 70605",,Lake Charles,LA,70605,3374786423,,Brenda,Lavine,3374911270,City of Lake Charles,2019-05-01T04:00:00.000Z,2019-08-31T04:00:00.000Z,"M,T,W,TH,F",8:30AM-12:30PM,8:30AM-9:30AM,11:30AM-12:30PM,,,,,7,U,US,34809,,2019,Calcasieu
-93.22331649,30.19364556,97805,College Oaks Recreation Center,Open,"3518 Ernest Street Lake Charles, LA 70605",,Lake Charles,LA,70605,3374911495,,Ericka,Harris,3374911270,City of Lake Charles,2019-05-01T04:00:00.000Z,2019-08-31T04:00:00.000Z,"M,T,W,TH,F",8:00AM-12:00PM,8:00AM-9:00AM,11:00AM-12:00PM,,,,,7,U,US,34939,,2019,Calcasieu
-93.18442019,30.19554667,97806,Columbus Circle Community Center,Open,"3520 Greinwich Boulevard Lake Charles, LA 70601",,Lake Charles,LA,70601,3374918782,,Judy,Guillory,3374911270,City of Lake Charles,2019-05-01T04:00:00.000Z,2019-08-31T04:00:00.000Z,"M,T,W,TH,F",8:30AM-1:00PM,8:30AM-9:30AM,12:00PM-1:00PM,,,,,7,U,US,34956,,2019,Calcasieu
-93.2361403,30.20194216,97807,For His Grace Baptist Church,Open,"1070 Deesport St. Lake Charles, LA 70601",,Lake Charles,LA,70601,3373095075,,Jennifer,Cormier,3374911270,City of Lake Charles,2019-05-01T04:00:00.000Z,2019-08-31T04:00:00.000Z,"M,T,W,TH,F",8:30AM-12:30PM,8:30AM-9:30AM,11:30AM-12:30PM,,,,,7,U,US,78122,,2019,Calcasieu
-93.18872188,30.23607146,97808,Foreman Community Center,Open,"215 Albert St Lake Charles, LA 70601",,Lake Charles,LA,70601,3374911440,,Sabrinia,Thomas,3374911270,City of Lake Charles,2019-05-01T04:00:00.000Z,2019-08-31T04:00:00.000Z,"M,T,W,TH,F",8:00AM-12:00PM,8:00AM-9:00AM,11:00AM-12:00PM,,,,,7,U,US,35754,,2019,Calcasieu
